{
  "id": "wf-incident-severity-no-mutation",
  "workflow": "showdar-incident",
  "selection": {
    "selectedStages": ["showdar-understand", "showdar-debug", "showdar-recover", "showdar-test"],
    "candidateStages": ["showdar-understand", "showdar-debug", "showdar-recover", "showdar-test", "showdar-ops"]
  },
  "steps": [
    { "op": "skip", "stage": "showdar-ops", "reason": "no-ops-authority", "policy": "no-ops-authority", "evidence": [] },
    { "op": "start", "stage": "showdar-understand" },
    { "op": "complete", "stage": "showdar-understand", "receipts": [{ "kind": "architecture-understood", "quality": "verified", "source": "showdar-understand" }] },
    { "op": "start", "stage": "showdar-debug" },
    { "op": "complete", "stage": "showdar-debug", "receipts": [{ "kind": "failure-reproduced", "quality": "verified", "source": "showdar-debug" }, { "kind": "root-cause-proven", "quality": "verified", "source": "showdar-debug" }] },
    { "op": "start", "stage": "showdar-recover" },
    { "op": "complete", "stage": "showdar-recover", "receipts": [{ "kind": "change-implemented", "quality": "verified", "source": "showdar-recover" }] },
    { "op": "start", "stage": "showdar-test" },
    { "op": "complete", "stage": "showdar-test", "receipts": [{ "kind": "targeted-tests-passed", "quality": "verified", "source": "showdar-test" }, { "kind": "relevant-suite-passed", "quality": "verified", "source": "showdar-test" }] },
    { "op": "finalize" }
  ],
  "resolutionStubs": {},
  "expected": {
    "status": "COMPLETE",
    "nextStage": null,
    "selectedStages": ["showdar-understand", "showdar-debug", "showdar-recover", "showdar-test"],
    "completedStages": ["showdar-understand", "showdar-debug", "showdar-recover", "showdar-test"],
    "skippedStages": ["showdar-ops"],
    "trace": [
      { "type": "workflow-created", "stage": null, "detail": { "selectedStages": ["showdar-understand", "showdar-debug", "showdar-recover", "showdar-test"], "candidateStages": ["showdar-understand", "showdar-debug", "showdar-recover", "showdar-test", "showdar-ops"] } },
      { "type": "stages-selected", "stage": null, "detail": { "selectedStages": ["showdar-understand", "showdar-debug", "showdar-recover", "showdar-test"] } },
      { "type": "stage-skipped", "stage": "showdar-ops", "detail": { "reason": "no-ops-authority", "policy": "no-ops-authority", "evidence": [] } },
      { "type": "stage-entered", "stage": "showdar-understand", "detail": {} },
      { "type": "stage-completed", "stage": "showdar-understand", "detail": { "receiptKinds": ["architecture-understood"], "receiptQualities": ["verified"] } },
      { "type": "stage-entered", "stage": "showdar-debug", "detail": {} },
      { "type": "stage-completed", "stage": "showdar-debug", "detail": { "receiptKinds": ["failure-reproduced", "root-cause-proven"], "receiptQualities": ["verified", "verified"] } },
      { "type": "stage-entered", "stage": "showdar-recover", "detail": {} },
      { "type": "stage-completed", "stage": "showdar-recover", "detail": { "receiptKinds": ["change-implemented"], "receiptQualities": ["verified"] } },
      { "type": "stage-entered", "stage": "showdar-test", "detail": {} },
      { "type": "stage-completed", "stage": "showdar-test", "detail": { "receiptKinds": ["relevant-suite-passed", "targeted-tests-passed"], "receiptQualities": ["verified", "verified"] } },
      { "type": "workflow-completed", "stage": null, "detail": { "completedStages": ["showdar-understand", "showdar-debug", "showdar-recover", "showdar-test"], "skippedStages": ["showdar-ops"] } },
      { "type": "workflow-completed", "stage": null, "detail": { "completedStages": ["showdar-understand", "showdar-debug", "showdar-recover", "showdar-test"], "skippedStages": ["showdar-ops"] } }
    ]
  }
}
