{
  "id": "wf-feature-full",
  "workflow": "showdar-feature",
  "selection": {
    "selectedStages": ["showdar-understand", "showdar-requirements", "showdar-plan", "showdar-design", "showdar-build", "showdar-test", "showdar-review"],
    "candidateStages": ["showdar-understand", "showdar-requirements", "showdar-plan", "showdar-design", "showdar-build", "showdar-test", "showdar-review"]
  },
  "steps": [
    { "op": "start", "stage": "showdar-understand" },
    { "op": "complete", "stage": "showdar-understand", "receipts": [{ "kind": "architecture-understood", "quality": "verified", "source": "showdar-understand" }] },
    { "op": "start", "stage": "showdar-requirements" },
    { "op": "complete", "stage": "showdar-requirements", "receipts": [{ "kind": "behavior-defined", "quality": "verified", "source": "showdar-requirements" }] },
    { "op": "start", "stage": "showdar-plan" },
    { "op": "complete", "stage": "showdar-plan", "receipts": [{ "kind": "architecture-understood", "quality": "verified", "source": "showdar-plan" }] },
    { "op": "start", "stage": "showdar-design" },
    { "op": "complete", "stage": "showdar-design", "receipts": [{ "kind": "targeted-tests-passed", "quality": "verified", "source": "showdar-design" }] },
    { "op": "start", "stage": "showdar-build" },
    { "op": "complete", "stage": "showdar-build", "receipts": [{ "kind": "change-implemented", "quality": "verified", "source": "showdar-build" }, { "kind": "targeted-tests-passed", "quality": "verified", "source": "showdar-build" }] },
    { "op": "start", "stage": "showdar-test" },
    { "op": "complete", "stage": "showdar-test", "receipts": [{ "kind": "targeted-tests-passed", "quality": "verified", "source": "showdar-test" }] },
    { "op": "start", "stage": "showdar-review" },
    { "op": "complete", "stage": "showdar-review", "receipts": [{ "kind": "targeted-tests-passed", "quality": "verified", "source": "showdar-review" }] },
    { "op": "finalize" }
  ],
  "resolutionStubs": {},
  "expected": {
    "status": "COMPLETE",
    "nextStage": null,
    "selectedStages": ["showdar-understand", "showdar-requirements", "showdar-plan", "showdar-design", "showdar-build", "showdar-test", "showdar-review"],
    "completedStages": ["showdar-understand", "showdar-requirements", "showdar-plan", "showdar-design", "showdar-build", "showdar-test", "showdar-review"],
    "skippedStages": [],
    "trace": [
      { "type": "workflow-created", "stage": null, "detail": { "selectedStages": ["showdar-understand", "showdar-requirements", "showdar-plan", "showdar-design", "showdar-build", "showdar-test", "showdar-review"], "candidateStages": ["showdar-understand", "showdar-requirements", "showdar-plan", "showdar-design", "showdar-build", "showdar-test", "showdar-review"] } },
      { "type": "stage-entered", "stage": "showdar-understand", "detail": {} },
      { "type": "stage-completed", "stage": "showdar-understand", "detail": { "receiptKinds": ["architecture-understood"], "receiptQualities": ["verified"] } },
      { "type": "stage-entered", "stage": "showdar-requirements", "detail": {} },
      { "type": "stage-completed", "stage": "showdar-requirements", "detail": { "receiptKinds": ["behavior-defined"], "receiptQualities": ["verified"] } },
      { "type": "stage-entered", "stage": "showdar-plan", "detail": {} },
      { "type": "stage-completed", "stage": "showdar-plan", "detail": { "receiptKinds": ["architecture-understood"], "receiptQualities": ["verified"] } },
      { "type": "stage-entered", "stage": "showdar-design", "detail": {} },
      { "type": "stage-completed", "stage": "showdar-design", "detail": { "receiptKinds": ["targeted-tests-passed"], "receiptQualities": ["verified"] } },
      { "type": "stage-entered", "stage": "showdar-build", "detail": {} },
      { "type": "stage-completed", "stage": "showdar-build", "detail": { "receiptKinds": ["change-implemented", "targeted-tests-passed"], "receiptQualities": ["verified", "verified"] } },
      { "type": "stage-entered", "stage": "showdar-test", "detail": {} },
      { "type": "stage-completed", "stage": "showdar-test", "detail": { "receiptKinds": ["targeted-tests-passed"], "receiptQualities": ["verified"] } },
      { "type": "stage-entered", "stage": "showdar-review", "detail": {} },
      { "type": "stage-completed", "stage": "showdar-review", "detail": { "receiptKinds": ["targeted-tests-passed"], "receiptQualities": ["verified"] } },
      { "type": "workflow-completed", "stage": null, "detail": { "completedStages": ["showdar-understand", "showdar-requirements", "showdar-plan", "showdar-design", "showdar-build", "showdar-test", "showdar-review"], "skippedStages": [] } },
      { "type": "workflow-completed", "stage": null, "detail": { "completedStages": ["showdar-understand", "showdar-requirements", "showdar-plan", "showdar-design", "showdar-build", "showdar-test", "showdar-review"], "skippedStages": [] } }
    ]
  }
}
