{
  "id": "wf-bugfix-proven-cause",
  "workflow": "showdar-bugfix",
  "selection": {
    "selectedStages": ["showdar-understand", "showdar-build", "showdar-test", "showdar-review"],
    "candidateStages": ["showdar-understand", "showdar-debug", "showdar-build", "showdar-test", "showdar-review"]
  },
  "steps": [
    { "op": "record", "receipts": [{ "kind": "root-cause-proven", "quality": "verified", "source": "showdar-debug" }] },
    { "op": "skip", "stage": "showdar-debug", "reason": "known-root-cause", "policy": "known-root-cause", "evidence": ["root-cause-proven"] },
    { "op": "start", "stage": "showdar-understand" },
    { "op": "complete", "stage": "showdar-understand", "receipts": [{ "kind": "architecture-understood", "quality": "verified", "source": "showdar-understand" }] },
    { "op": "start", "stage": "showdar-build" },
    { "op": "complete", "stage": "showdar-build", "receipts": [{ "kind": "change-implemented", "quality": "verified", "source": "showdar-build" }] },
    { "op": "start", "stage": "showdar-test" },
    { "op": "complete", "stage": "showdar-test", "receipts": [{ "kind": "targeted-tests-passed", "quality": "verified", "source": "showdar-test" }] },
    { "op": "start", "stage": "showdar-review" },
    { "op": "complete", "stage": "showdar-review", "receipts": [{ "kind": "targeted-tests-passed", "quality": "verified", "source": "showdar-review" }] },
    { "op": "finalize" }
  ],
  "resolutionStubs": {},
  "expected": {
    "status": "COMPLETE",
    "nextStage": null,
    "selectedStages": ["showdar-understand", "showdar-build", "showdar-test", "showdar-review"],
    "completedStages": ["showdar-understand", "showdar-build", "showdar-test", "showdar-review"],
    "skippedStages": ["showdar-debug"],
    "trace": [
      { "type": "workflow-created", "stage": null, "detail": { "selectedStages": ["showdar-understand", "showdar-build", "showdar-test", "showdar-review"], "candidateStages": ["showdar-understand", "showdar-debug", "showdar-build", "showdar-test", "showdar-review"] } },
      { "type": "stages-selected", "stage": null, "detail": { "selectedStages": ["showdar-understand", "showdar-build", "showdar-test", "showdar-review"] } },
      { "type": "evidence-recorded", "stage": null, "detail": { "receiptKinds": ["root-cause-proven"], "receiptQualities": ["verified"] } },
      { "type": "stage-skipped", "stage": "showdar-debug", "detail": { "reason": "known-root-cause", "policy": "known-root-cause", "evidence": ["root-cause-proven"] } },
      { "type": "stage-entered", "stage": "showdar-understand", "detail": {} },
      { "type": "stage-completed", "stage": "showdar-understand", "detail": { "receiptKinds": ["architecture-understood"], "receiptQualities": ["verified"] } },
      { "type": "stage-entered", "stage": "showdar-build", "detail": {} },
      { "type": "stage-completed", "stage": "showdar-build", "detail": { "receiptKinds": ["change-implemented"], "receiptQualities": ["verified"] } },
      { "type": "stage-entered", "stage": "showdar-test", "detail": {} },
      { "type": "stage-completed", "stage": "showdar-test", "detail": { "receiptKinds": ["targeted-tests-passed"], "receiptQualities": ["verified"] } },
      { "type": "stage-entered", "stage": "showdar-review", "detail": {} },
      { "type": "stage-completed", "stage": "showdar-review", "detail": { "receiptKinds": ["targeted-tests-passed"], "receiptQualities": ["verified"] } },
      { "type": "workflow-completed", "stage": null, "detail": { "completedStages": ["showdar-understand", "showdar-build", "showdar-test", "showdar-review"], "skippedStages": ["showdar-debug"] } },
      { "type": "workflow-completed", "stage": null, "detail": { "completedStages": ["showdar-understand", "showdar-build", "showdar-test", "showdar-review"], "skippedStages": ["showdar-debug"] } }
    ]
  }
}
