{
  "id": "wf-release-security-skipped",
  "workflow": "showdar-release",
  "selection": {
    "selectedStages": ["showdar-quality", "showdar-ship"],
    "candidateStages": ["showdar-quality", "showdar-security", "showdar-ship", "showdar-ops"]
  },
  "steps": [
    { "op": "skip", "stage": "showdar-security", "reason": "no-security-risk", "policy": "no-security-risk", "evidence": [] },
    { "op": "start", "stage": "showdar-quality" },
    { "op": "complete", "stage": "showdar-quality", "receipts": [{ "kind": "architecture-understood", "quality": "verified", "source": "showdar-quality" }] },
    { "op": "start", "stage": "showdar-ship" },
    { "op": "complete", "stage": "showdar-ship", "receipts": [{ "kind": "release-readiness-verified", "quality": "verified", "source": "showdar-ship" }] },
    { "op": "finalize" }
  ],
  "resolutionStubs": {},
  "expected": {
    "status": "COMPLETE",
    "nextStage": null,
    "selectedStages": ["showdar-quality", "showdar-ship"],
    "completedStages": ["showdar-quality", "showdar-ship"],
    "skippedStages": ["showdar-security"],
    "trace": [
      { "type": "workflow-created", "stage": null, "detail": { "selectedStages": ["showdar-quality", "showdar-ship"], "candidateStages": ["showdar-quality", "showdar-security", "showdar-ship", "showdar-ops"] } },
      { "type": "stages-selected", "stage": null, "detail": { "selectedStages": ["showdar-quality", "showdar-ship"] } },
      { "type": "stage-skipped", "stage": "showdar-security", "detail": { "reason": "no-security-risk", "policy": "no-security-risk", "evidence": [] } },
      { "type": "stage-entered", "stage": "showdar-quality", "detail": {} },
      { "type": "stage-completed", "stage": "showdar-quality", "detail": { "receiptKinds": ["architecture-understood"], "receiptQualities": ["verified"] } },
      { "type": "stage-entered", "stage": "showdar-ship", "detail": {} },
      { "type": "stage-completed", "stage": "showdar-ship", "detail": { "receiptKinds": ["release-readiness-verified"], "receiptQualities": ["verified"] } },
      { "type": "workflow-completed", "stage": null, "detail": { "completedStages": ["showdar-quality", "showdar-ship"], "skippedStages": ["showdar-security"] } },
      { "type": "workflow-completed", "stage": null, "detail": { "completedStages": ["showdar-quality", "showdar-ship"], "skippedStages": ["showdar-security"] } }
    ]
  }
}
